module_id,question_id,question_order,question_text,Answer
budget,q6,6,"Why should salespeople avoid projecting their own financial limits onto prospects?","CA: Because what feels expensive to the salesperson may be affordable to the prospect.
IA: Because prospects always have more money.
IA: Because pricing should never be discussed.
IA: Because it weakens authority."
budget,q7,7,"Why does Sandler stress addressing payment terms upfront?","CA: To prevent future collection problems and misunderstandings.
IA: To pressure prospects into buying.
IA: To delay the decision step.
IA: To justify higher prices."
budget,q8,8,"Why does Sandler recommend using the word 'investment' instead of 'cost'?","CA: It implies a return rather than a simple cash outlay.
IA: It sounds more professional.
IA: It avoids budget discussions.
IA: It guarantees a sale."
budget,q9,9,"When is a sale truly closed according to the Sandler rules?","CA: When payment is received, taken to the bank, and cleared.
IA: When the contract is signed.
IA: When the proposal is accepted.
IA: When the prospect agrees verbally."
decision,q1,1,"What is the primary objective of the decision step?","CA: To understand how the prospect makes decisions and secure clarity.
IA: To close aggressively.
IA: To present features.
IA: To negotiate price."
decision,q2,2,"Why should decision authority always be verified?","CA: Because decisions are often shared or delegated.
IA: Because prospects exaggerate authority.
IA: Because authority is irrelevant.
IA: Because budget matters more."
decision,q3,3,"What must be confirmed before offering a presentation?","CA: Agreement on pain budget and next steps.
IA: Demo availability.
IA: Feature requests.
IA: Contract terms."
decision,q4,4,"When should the intermediate decision-making technique be used?","CA: When the prospect is not the final decision maker.
IA: When closing quickly.
IA: When price resistance exists.
IA: When budget is unknown."
decision,q5,5,"Who typically holds final authority in organizations?","CA: The stars with control over resources.
IA: End users.
IA: Supporting staff.
IA: Bit players."
decision,q6,6,"Why should referral influence be explored early?","CA: To leverage internal credibility and access.
IA: To bypass process.
IA: To discount pricing.
IA: To rush decisions."
decision,q7,7,"According to Sandler when is a decision step strong?","CA: When a clear yes or no is required.
IA: When prospects feel comfortable.
IA: When demos are delivered.
IA: When objections stop."
closing,q1,73,"What does Sandler consider the actual close?","CA: The upfront contract covering pain, budget, and decision.
IA: The final presentation.
IA: The signed proposal.
IA: Payment discussion."
closing,q2,74,"What is the sole purpose of the presentation step?","CA: To confirm the close and get the order.
IA: To persuade the prospect.
IA: To educate in depth.
IA: To overcome objections."
closing,q3,75,"What is the biggest mistake in fulfillment?","CA: Failing to review pain, budget, and decision clearly.
IA: Using too many slides.
IA: Talking too little.
IA: Asking for the order."
closing,q4,76,"Why must commitment exist before doing work?","CA: To protect time and prevent competitor interference.
IA: To speed implementation.
IA: To justify pricing.
IA: To increase rapport."
closing,q5,77,"What does the thermometer technique help determine?","CA: Readiness to buy.
IA: Authority level.
IA: Budget size.
IA: Product knowledge."
closing,q6,78,"When is the best time to handle buyer’s remorse?","CA: During the post-sell step.
IA: After delivery.
IA: During negotiation.
IA: Before presentation."
closing,q7,79,"When is a sale officially closed in Sandler selling?","CA: When payment is received and clears.
IA: When the proposal is accepted.
IA: When the prospect agrees verbally.
IA: When the presentation ends."
call-reluctance,q1,1,"What is call reluctance in the Sandler system?","CA: Call reluctance is the hesitation or fear to make prospecting calls that limits sales activity.
IA: Call reluctance is caused by poor pricing.
IA: Call reluctance only affects new salespeople.
IA: Call reluctance means prospects dislike being contacted."
call-reluctance,q2,2,"What two primary factors cause call reluctance?","CA: Low self-concept and lack of prospecting skills.
IA: Poor scripts and weak objection handling.
IA: Market saturation and competition.
IA: CRM systems and lead quality."
call-reluctance,q3,3,"What mindset reduces pressure during prospecting calls?","CA: Acting financially independent and not needing the business.
IA: Sounding enthusiastic and energetic.
IA: Explaining credentials early.
IA: Asking many questions quickly."
call-reluctance,q4,4,"Why must a salesperson avoid sounding desperate on the phone?","CA: Desperation creates emotional pressure that prospects can feel.
IA: Desperation increases urgency.
IA: Desperation helps overcome objections.
IA: Desperation builds empathy."
call-reluctance,q5,5,"What is the Sandler rule when setting appointments?","CA: You must get invited in and never beg.
IA: Push until the prospect agrees.
IA: Offer discounts to secure meetings.
IA: Explain benefits in detail first."
call-reluctance,q6,6,"What is the purpose of the mini-contract?","CA: To gain permission to explain the reason for the call and give control to the prospect.
IA: To close the sale immediately.
IA: To qualify budget early.
IA: To overcome objections."
call-reluctance,q7,7,"What is the goal of a cold call in the Sandler system?","CA: To secure an appointment.
IA: To educate the prospect.
IA: To present the solution.
IA: To negotiate pricing."
call-reluctance,q8,8,"How should gatekeepers be handled according to Sandler?","CA: With a natural, conversational approach that avoids defensiveness.
IA: With authority and job titles.
IA: With detailed explanations.
IA: With persistence."
call-reluctance,q9,9,"What does ‘send me some literature’ usually indicate?","CA: A polite attempt to end the call.
IA: Strong buying interest.
IA: A pricing request.
IA: Readiness to meet."
call-reluctance,q10,10,"When can a salesperson truly fail at prospecting?","CA: Only when they stop prospecting.
IA: When rejection rates are high.
IA: When scripts stop working.
IA: When leads are unqualified."
BAT-average,q1,1,What are the three points of the Sandler Success Triangle?,"CA: Behavior attitude and technique.
IA: Beliefs actions and timing.
IA: Budget authority and trust.
IA: Bonding pain and closing."
BAT-average,q2,2,Why is attitude placed at the top of the triangle?,"CA: Because attitude drives beliefs thoughts feelings and actions.
IA: Because technique is difficult.
IA: Because behavior is automatic.
IA: Because markets control outcomes."
BAT-average,q3,3,What are the three points of the U-Triangle?,"CA: Spirit mind and body.
IA: Goals plans and actions.
IA: Personal presence tactics and strategy.
IA: Qualify close and fulfill."
BAT-average,q4,4,How should sales goals be set according to Sandler?,"CA: Based on behaviors you can control.
IA: Based on revenue only.
IA: Based on close rate.
IA: Based on presentations."
BAT-average,q5,5,What is Minimum Daily Behavior?,"CA: Consistent daily actions required for success.
IA: Weekly motivation routine.
IA: Closing script.
IA: Cold call opener."
BAT-average,q6,6,What are the three points of the technique triangle?,"CA: Personal presence tactics and strategy.
IA: Attitude behavior and technique.
IA: Qualify close and fulfill.
IA: Spirit mind and body."
BAT-average,q7,7,What is the correct fulfillment approach?,"CA: Review the contract and present only pain solving elements.
IA: Present all features.
IA: Focus on objections.
IA: Delay value discussion."
BAT-average,q8,8,What determines how you feel according to Sandler?,"CA: How you act determines how you feel.
IA: How you feel determines how you act.
IA: Results determine emotions.
IA: Motivation precedes action."
ta-sales-situation,q1,1,"What is the primary goal of Transactional Analysis in selling?","CA: To understand and manage ego states to improve communication and buying decisions.
IA: To manipulate prospects emotionally.
IA: To replace traditional sales techniques.
IA: To close faster using pressure."
ta-sales-situation,q2,2,"Why is the Adult ego state essential at the beginning of a sale?","CA: It establishes clear, honest agreements through upfront contracts.
IA: It pressures the prospect logically.
IA: It replaces emotional selling.
IA: It removes the need for nurturing."
ta-sales-situation,q3,3,"What role does the Child ego state play in buying decisions?","CA: It is the part that emotionally wants to buy.
IA: It approves budgets.
IA: It sets pricing.
IA: It negotiates contracts."
ta-sales-situation,q4,4,"Why is nurturing critical when a prospect is in pain?","CA: Because pain triggers the child ego state and must be soothed before logic resumes.
IA: Because it accelerates closing.
IA: Because it avoids objections.
IA: Because it builds urgency."
ta-sales-situation,q5,5,"What causes crossed transactions in sales?","CA: Responding from the wrong ego state.
IA: Asking budget questions too early.
IA: Presenting features.
IA: Using humor incorrectly."
ta-sales-situation,q6,6,"How does Sandler recommend preventing manipulative selling?","CA: By setting upfront contracts between Adult ego states.
IA: By increasing urgency.
IA: By controlling the conversation tightly.
IA: By appealing to fear."
ta-sales-situation,q7,7,"What is the correct ego-state mix in Sandler selling?","CA: 0% Critical Parent, 30% Adult, 70% Nurturing Parent.
IA: 50% Adult, 50% Child.
IA: 70% Adult, 30% Parent.
IA: Equal balance of all states."
ta-sales-situation,q8,8,"What is the ultimate risk of ignoring ego states in selling?","CA: Creating resistance, backouts, and emotional breakdowns.
IA: Longer presentations.
IA: Slower qualification.
IA: Reduced product knowledge."
setting-goals-1,q1,1,Which type of motivation produces lasting results?,"CA: Attitude motivation.
IA: Incentive motivation.
IA: Fear motivation.
IA: Peer pressure."
setting-goals-1,q2,2,Why do people often fail to achieve goals?,"CA: They do not write goals down or create a structured plan.
IA: They lack talent.
IA: They do not want success.
IA: They are unlucky."
setting-goals-1,q3,3,What role does visualization play in goal achievement?,"CA: It builds belief expectation and emotional connection to goals.
IA: It replaces discipline.
IA: It guarantees outcomes.
IA: It removes obstacles."
setting-goals-1,q4,4,Why should goals align with personal values?,"CA: To avoid inner conflict and maintain long-term motivation.
IA: To increase authority.
IA: To impress others.
IA: To reduce effort."
setting-goals-1,q5,5,What is the correct way to handle head trash?,"CA: Accept it understand it and minimize its impact.
IA: Eliminate it completely.
IA: Ignore it.
IA: Replace it with pressure."
setting-goals-1,q6,6,What is emphasized in the eleven-step plan of action?,"CA: Structure accountability flexibility and persistence.
IA: Speed and intensity.
IA: External rewards.
IA: Competition with others."
setting-goals-1,q7,7,What happens when someone has no personal plan?,"CA: They become part of someone else's plan.
IA: They gain freedom.
IA: They reduce responsibility.
IA: They become more flexible."
setting-goals-1,q8,8,Why does fear motivation fail over time?,"CA: People become desensitized hesitant or quit altogether.
IA: Fear permanently increases performance.
IA: Fear improves creativity.
IA: Fear strengthens confidence."
setting-goals-1,q9,9,According to Maslow what must be satisfied before self-actualization?,"CA: Lower-level needs such as physiological safety and social needs.
IA: Recognition from others.
IA: Financial wealth.
IA: Career success."
setting-goals-1,q10,10,Why is writing goals down important?,"CA: Written goals increase commitment clarity and follow-through.
IA: Writing goals replaces action.
IA: Writing goals guarantees success.
IA: Writing goals reduces accountability."
setting-goals-1,q11,11,What is the purpose of breaking goals into checkpoints?,"CA: To make large goals manageable and track progress over time.
IA: To slow progress.
IA: To avoid responsibility.
IA: To reduce ambition."
