module_id,question_id,question_order,question_text,Answer
why-have-a-system,q1,1,How have traditional sales strategies remained ineffective over time?,"CA: Traditional strategies like being aggressive, showing enthusiasm, making polished presentations, overcoming objections, and closing repeatedly have not changed in 50 years, so prospects have stopped listening and learned to control the process.
IA: Modern sales strategies focus primarily on product speed and automation, making relationship skills less important.
IA: Traditional sales methods have disappeared entirely because prospects are now more trusting and passive.
IA: The primary issue in modern selling is that prospects no longer care about presentations or objections at all."
why-have-a-system,q2,2,What are the four different positive results you can get with the Sandler Selling System?,"CA: A yes, a no, a referral, or a clear future commitment.
IA: A demo booking, a trial sign-up, a price negotiation, or a follow-up email.
IA: A partial yes, a maybe later, a budget discovery, or a competitor discussion.
IA: A request for more information, a stalled deal, a voicemail exchange, or an objection that needs handling."
why-have-a-system,q3,3,"According to the Sandler trainer, why do salespeople generally fail?","CA: Salespeople generally fail because they are systemless, using outdated concepts, strategies, and techniques rather than lacking motivation or ability.
IA: Most salespeople fail because prospects simply don’t have enough budget in modern markets.
IA: Salespeople struggle primarily because they ask too many questions instead of presenting.
IA: Failure usually comes from spending too much time with highly qualified prospects."
why-have-a-system,q4,4,How do prospects typically view the buyer-seller relationship?,"CA: Salespeople generally fail because they are systemless, using outdated concepts, strategies, and techniques rather than lacking motivation or ability.
IA: Most salespeople fail because prospects simply don’t have enough budget in modern markets.
IA: Salespeople struggle primarily because they ask too many questions instead of presenting.
IA: Failure usually comes from spending too much time with highly qualified prospects."
why-have-a-system,q5,5,How does the Sandler system suggest salespeople handle being stuck in the typical four-step process?,"CA: The Sandler system encourages taking a new approach that creates a win-win rather than chasing unresponsive prospects.
IA: The Sandler system recommends increasing follow-up frequency until the prospect responds.
IA: The system encourages repeatedly overcoming objections to wear down resistance.
IA: Sandler suggests presenting more features to regain the prospect’s attention."
why-have-a-system,q6,6,Why does the Sandler selling system use a submarine to represent the system?,"CA: The Sandler system encourages taking a new approach that creates a win-win rather than chasing unresponsive prospects.
IA: The Sandler system recommends increasing follow-up frequency until the prospect responds.
IA: The system encourages repeatedly overcoming objections to wear down resistance.
IA: Sandler suggests presenting more features to regain the prospect’s attention."
why-have-a-system,q7,7,What are the three most important things to find out early in a sales call according to Sandler?,"CA: The Sandler system encourages taking a new approach that creates a win-win rather than chasing unresponsive prospects.
IA: The Sandler system recommends increasing follow-up frequency until the prospect responds.
IA: The system encourages repeatedly overcoming objections to wear down resistance.
IA: Sandler suggests presenting more features to regain the prospect’s attention."
why-have-a-system,q8,8,How should a salesperson present their solution in the fulfillment step?,"CA: The Sandler system encourages taking a new approach that creates a win-win rather than chasing unresponsive prospects.
IA: The Sandler system recommends increasing follow-up frequency until the prospect responds.
IA: The system encourages repeatedly overcoming objections to wear down resistance.
IA: Sandler suggests presenting more features to regain the prospect’s attention."
why-have-a-system,q9,9,How can a salesperson avoid ending up at Wimp Junction?,"CA: Follow your own sales system and maintain control instead of defaulting to the prospect’s system.
IA: Give early discounts to prevent prospects from taking control.
IA: Allow the prospect to dictate the call to build trust.
IA: Focus mainly on objection handling at the end of the call."

why-have-a-system,q10,10,What kind of responses do you want from prospects?,"CA: Follow your own sales system and maintain control instead of defaulting to the prospect’s system.
IA: Give early discounts to prevent prospects from taking control.
IA: Allow the prospect to dictate the call to build trust.
IA: Focus mainly on objection handling at the end of the call."
bonding-rapport,q1,11,How can a small detail like offering coffee affect a sales call?,"CA: Offering coffee and how you respond can instantly build or break rapport in a sales interaction.
IA: Coffee is offered simply as a courtesy and has no effect on rapport.
IA: Declining coffee always shows confidence and improves your sales position.
IA: Accepting coffee is always unprofessional and should be avoided."

bonding-rapport,q2,12,What is the ordinary meaning of rapport in the context of sales?,"CA: Rapport means relating or sharing a common connection with another person.
IA: Rapport means impressing someone with product knowledge.
IA: Rapport means convincing someone to like your offer quickly.
IA: Rapport means mirroring body language perfectly every time."

bonding-rapport,q3,13,Why is physiology important in communication?,"CA: Physiology accounts for 55% of communication and shapes how prospects perceive you.
IA: Physiology only matters at the end of the sales presentation.
IA: Physiology accounts for less than 10% of communication.
IA: Body language is irrelevant as long as you speak confidently."

bonding-rapport,q4,14,How can you identify someone's primary sensory dominance through their speech?,"CA: You identify sensory dominance by listening to speech rate and word choice.
IA: Sensory dominance is determined only by what products the prospect prefers.
IA: Sensory dominance can be identified by posture alone.
IA: All prospects use the same sensory style regardless of speech patterns."

bonding-rapport,q5,15,What is an example of a visual detail that distracted a prospect despite the salesperson's impressive appearance?,"CA: A salesperson’s appearance mistake (white socks) distracted the prospect from the sales message.
IA: The prospect was distracted because the salesperson spoke too loudly.
IA: The sale failed because the product features were too complicated.
IA: The prospect was distracted because the salesperson used too many visual aids."

bonding-rapport,q6,16,What is the benefit of selling to an auditory prospect?,"CA: Auditory prospects often become loyal repeat customers who recommend the product to others.
IA: Auditory prospects rarely buy again and seldom share their experiences.
IA: Auditory prospects only buy once and do not respond to follow-up.
IA: Auditory prospects rely mainly on written reviews before buying."

bonding-rapport,q7,17,What words do kinesthetics frequently use?,"CA: Kinesthetic prospects use touch-related words like warm, feel, handle, and firm.
IA: Kinesthetic prospects mostly use visual metaphors like “I see what you mean.”
IA: Kinesthetic prospects speak quickly using analytical terms.
IA: Kinesthetic prospects avoid emotional or sensory words entirely."

bonding-rapport,q8,18,What is the best way to gain control in a sales conversation according to Sandler?,"CA: The best way to gain control is to help the prospect feel okay.
IA: The best way to gain control is to dominate the conversation early.
IA: The best way to gain control is to overwhelm the prospect with facts.
IA: The best way to gain control is to close as quickly as possible."

bonding-rapport,q9,19,What are the two kinds of strokes in transactional analysis?,"CA: Positive strokes are warm fuzzies; negative strokes are cold pricklies.
IA: Strokes only refer to compliments, never criticism.
IA: Cold pricklies are used to motivate prospects to act quickly.
IA: Warm fuzzies are a closing technique used after the presentation."

bonding-rapport,q20,10,What does the phrase 'You are my friend when you walk in my moccasins' imply in the Sandler context?,"CA: It means understanding and empathizing with the prospect’s point of view.
IA: It means agreeing with everything the prospect says.
IA: It means steering the conversation back to features and benefits.
IA: It means focusing only on presenting your own perspective."

upfront-contracts,q1,21,What problem can occur if you don't establish an upfront contract before a sales call?,"CA: You can lose control of the sales call before it starts, resulting in rushed conversations and unclear expectations.
IA: You can only lose control of a call at the close, never at the beginning.
IA: Losing control early usually helps build rapport.
IA: Control is not important if you have a strong product."

upfront-contracts,q2,22,What should you do if you encounter stalls or objections during prospecting calls?,"CA: You should seek additional guidance from your trainer to handle stalls and objections.
IA: You should ignore stalls because they disappear on their own.
IA: You should handle all objections by offering discounts.
IA: You should avoid asking for help, as it weakens your sales position."

upfront-contracts,q3,23,What is the role of questions in an upfront contract?,"CA: Questions help both sides understand needs and determine fit and next steps.
IA: Questions should be minimized to avoid slowing the sales process.
IA: Questions are mainly used to qualify budget only.
IA: Questions are unnecessary if the salesperson knows the script."

upfront-contracts,q4,24,Why might salespeople forget to set an upfront contract according to the text?,"CA: Salespeople may get excited about problems and forget to set their own call agenda.
IA: Salespeople should avoid setting agendas to stay flexible.
IA: Stating objectives reduces rapport and should be avoided.
IA: The agenda should only be set after the prospect commits to buying."

upfront-contracts,q5,25,Why is it important for the salesperson to understand the prospect's pain early in the sales process?,"CA: Understanding pain early allows intelligent offers and helps decide whether to continue.
IA: Pain should be explored only at the end of the call.
IA: Pain is irrelevant unless the buyer asks about price.
IA: Pain is optional because most prospects buy without it."

upfront-contracts,q6,26,What is the benefit of openly admitting to a problem like difficulty asking for the sale?,"CA: It invites the prospect to help solve the problem, creating honesty and collaboration.
IA: It shifts all responsibility to the prospect.
IA: It avoids discussion of the real issue entirely.
IA: It increases pressure on the prospect to respond quickly."

upfront-contracts,q7,27,What happens if a salesperson ignores a prospect's objection or stall?,"CA: If an objection isn’t eliminated, the opportunity may be lost.
IA: Objections are unimportant and rarely impact the sale.
IA: Objections should be ignored until after the close.
IA: Any objection means the prospect is not qualified and should be dropped immediately."

upfront-contracts,q8,28,What are the acceptable responses George can give after the demo?,"CA: Acceptable responses are clear yes/no signals; vague replies like “Let me get back to you” are not acceptable.
IA: “Let me get back to you” is the strongest buying signal.
IA: A vague answer is always a sign of strong interest.
IA: Any response is acceptable as long as the salesperson keeps talking."

upfront-contracts,q9,29,What is the purpose of a rough draft contract in sales proposals?,"CA: Rough drafts create an initial proposal that is reviewed before finalizing.
IA: Rough drafts are binding agreements that close the deal.
IA: Rough drafts replace the need for any prospect feedback.
IA: Rough drafts are used only after the prospect has already agreed to buy."

upfront-contracts,q10,30,What is a 'milk run' in the context of this role play?,"CA: A milk run is regularly visiting the same customer even without orders.
IA: A milk run is a rapid-fire calling session to many new leads.
IA: A milk run is a pricing strategy used in competitive bidding.
IA: A milk run refers to offering free samples to prospects."

upfront-contracts,q11,31,Why is it important to tell prospects upfront what will happen to them?,"CA: Because people aren’t afraid if you tell them upfront what will happen, and you can’t blame them for breaking rules you never stated.
IA: Because telling prospects nothing builds curiosity and urgency.
IA: Because upfront explanations weaken your authority.
IA: Because prospects prefer to guess the process rather than be told."

questioning-1,q1,32,Why might salespeople struggle with not sharing their knowledge early?,"CA: Salespeople struggle because they want to share their expertise and it’s hard to hold back after investing time learning it.
IA: Salespeople struggle because prospects always want full technical explanations.
IA: Salespeople struggle because sharing everything early guarantees faster closes.
IA: Salespeople struggle because prospects prefer salespeople who talk nonstop."
questioning-1,q2,33,What is the dummy curve in sales according to David Sandler?,"CA: The dummy curve prevents early information dumping by moving through dummy amateur and professional phases.
IA: The dummy curve is designed only for overcoming price objections.
IA: The dummy curve is mainly for delivering complex technical explanations.
IA: The dummy curve replaces discovery and rapport building."
questioning-1,q3,34,What is the significance of the statement 'Selling is a Broadway play performed by a psychiatrist'?,"CA: Selling involves acting and psychological skills to understand and influence the prospect effectively.
IA: Selling works best when you show your true personality without structure.
IA: Selling requires no psychology — only product knowledge.
IA: Selling is purely about price negotiation."
questioning-1,q4,35,What does it mean that the salesperson is 'staying out of the box' and 'in the professional phase of the dummy curve'?,"CA: It means the salesperson is using the dummy curve professionally adapting the conversation to stay in control.
IA: It means the salesperson is avoiding asking any questions.
IA: It means the salesperson should lead with features immediately.
IA: It means the salesperson is hiding their intentions from the prospect."
questioning-1,q5,36,What does the speaker imply about being yourself during a sales call?,"CA: Being yourself won’t work because prospects won’t buy if you simply act like yourself.
IA: Being yourself is always the most effective sales strategy.
IA: Being yourself guarantees faster rapport.
IA: Being yourself eliminates the need for technique or preparation."
questioning-1,q6,37,What is the rule David Sandler gives about selling and educating?,"CA: The rule is sell today and educate tomorrow — let the prospect get their picture first.
IA: The rule is educate fully before selling anything.
IA: The rule is bombard prospects with features as early as possible.
IA: The rule is always provide detailed technical explanations upfront."
questioning-1,q7,38,What is the main challenge when making changes to a prospect's mental picture during a sales interview?,"CA: Changing a prospect’s mental picture may make them uncomfortable so it must be handled carefully.
IA: Prospects always welcome additional details and changes to their picture.
IA: The salesperson should control the picture entirely without input.
IA: Prospects rarely form mental pictures so this is not a concern."
questioning-1,q8,39,What is the difference between a professional salesperson and a dummy as per David Sandler's explanation?,"CA: A professional repeats what he did as a dummy but now does it deliberately and on purpose.
IA: A professional avoids dummy-curve behaviors entirely.
IA: A professional focuses mainly on presenting features.
IA: A professional no longer asks questions and leads with solutions."
questioning-1,q9,40,What does 'What you know can hurt you so dummy up' mean?,"CA: It means sharing too much knowledge can be harmful; sometimes it’s better to hold back and listen.
IA: It means you should always answer every question immediately.
IA: It means the more you talk the more control you gain.
IA: It means prospects prefer long technical explanations early in the process."
questioning-2,q1,41,What does reversing help salespeople avoid?,"CA: Giving away expertise before knowing if the prospect needs or wants it, known as “spilling your candy in the lobby,” which also leads to premature presentations.
IA: Giving too little information makes prospects distrustful.
IA: Sharing expertise early shortens the sales cycle.
IA: Prospects expect full explanations before any questioning."
questioning-2,q2,42,What example is used to illustrate how people learn not to ask direct questions?,"CA: The story of little Jimmy shows how people avoid asking the real question directly and instead use smokescreen questions to avoid confrontation.
IA: The story shows children are naturally manipulative.
IA: The lesson is that persistence always leads to getting what you want.
IA: The story illustrates why punishment improves communication."
questioning-2,q3,43,How does the prospect respond to the statement about not being able to make a decision?,"CA: The prospect says “No” but clarifies they would buy if the house were right and within budget.
IA: The prospect is firmly opposed to buying anything.
IA: The prospect is trying to negotiate aggressively.
IA: The prospect is only interested in renting."
questioning-2,q4,44,What happens when a salesperson talks too much during a sales conversation?,"CA: Talking too much boxes the salesperson in, causes the prospect to stop talking, and results in missed needs and objections.
IA: Talking more helps dominate the conversation and close faster.
IA: Prospects prefer salespeople who do most of the talking.
IA: Control increases when the salesperson fills silence."
questioning-2,q5,45,Why is nurturing important when using reversing techniques?,"CA: Nurturing makes questions sound caring, sincere, and concerned instead of abrasive or confrontational.
IA: Nurturing is mainly used to soften pricing discussions.
IA: Nurturing is a technique used only at the close.
IA: Nurturing replaces the need for questioning skills."
questioning-2,q6,46,What does Sandler say about traditional closing techniques?,"CA: He recommends abandoning traditional closing techniques and letting prospects close themselves using reversing.
IA: He suggests using stronger closing pressure.
IA: He recommends presenting more features at the close.
IA: He advises delaying decisions indefinitely."
questioning-2,q7,47,How does emotional involvement affect a prospect's awareness during a sales conversation?,"CA: Emotional involvement distracts prospects so they don’t notice the sales techniques being used.
IA: Emotional involvement makes prospects more analytical.
IA: Emotional involvement increases resistance to buying.
IA: Emotional involvement eliminates the need for trust."
questioning-2,q8,48,What does the 'off the record' reverse do in a sales conversation?,"CA: It lowers pressure by framing questions as confidential, which encourages openness.
IA: It increases urgency by limiting information.
IA: It pressures prospects into revealing budget.
IA: It discourages honest responses."
questioning-2,q9,49,How can a salesperson handle the phrase 'I'll get back to you' from a prospect?,"CA: The salesperson uses clarifying questions to uncover what “I’ll get back to you” really means.
IA: The salesperson should accept the statement and move on.
IA: The phrase always means strong buying interest.
IA: The best response is to present pricing again."
questioning-2,q10,50,What happens when a question is reversed by a prospect?,"CA: When reversed, the prospect will always redefine the question.
IA: Reversing causes prospects to end the conversation.
IA: Reversing only works with analytical buyers.
IA: Reversing is a closing technique rather than a questioning tool."

pain,q1,51,"What is the purpose of the pain step in the Sandler sales system?","CA: To help the prospect emotionally connect to problems that your product or service may solve.
IA: To present features and benefits early.
IA: To pressure the prospect into making a decision.
IA: To qualify budget before discovery."
pain,q2,52,"What is the key difference between pain and interest in Sandler selling?","CA: Pain is emotional, while interest is intellectual curiosity.
IA: Pain is logical, while interest is emotional.
IA: Pain relates only to budget, interest to authority.
IA: Pain and interest are the same thing."
pain,q3,53,"Why should salespeople avoid digging into pain like trained psychologists?","CA: Because salespeople are not clinically trained and must stay within a sales role.
IA: Because prospects dislike emotional discussions.
IA: Because it makes the sales cycle too long.
IA: Because pain should only be handled at the close."
pain,q4,54,"What is the main objective of determining fit versus no fit during the pain step?","CA: To create a win-win outcome by confirming whether your solution truly helps the prospect.
IA: To outperform competitors.
IA: To keep the conversation going as long as possible.
IA: To justify a higher price."
pain,q5,55,"What is negative reverse selling designed to do?","CA: Encourage prospects to talk more by reducing pressure and resistance.
IA: Force prospects to defend their objections.
IA: Increase urgency by challenging the prospect.
IA: Push the prospect toward a quick close."
pain,q6,56,"Why do features and benefits fail to sell on their own?","CA: Because prospects hear the same features and benefits from many competitors.
IA: Because features are too technical.
IA: Because prospects only care about price.
IA: Because benefits should be avoided entirely."
pain,q7,57,"What happens in the critical stage of the Sandler pain formula?","CA: The prospect feels urgent pain and is ready to fix the problem immediately.
IA: The prospect compares vendors.
IA: The prospect delays the decision.
IA: The prospect asks for a presentation."
pain,q8,58,"What is the purpose of the Sandler pain funnel?","CA: To uncover the real problem, its causes, and its personal impact.
IA: To follow a scripted list of questions.
IA: To move quickly to pricing.
IA: To qualify authority early."
pain,q9,59,"What is the correct mindset when uncovering a prospect’s pain?","CA: Guiding the prospect to discover their own pain.
IA: Convincing the prospect they have pain.
IA: Diagnosing the problem for the prospect.
IA: Educating the prospect on solutions."
pain,q10,60,"What distinguishes real pain from a pain indicator?","CA: Real pain is emotional, not just intellectual.
IA: Real pain always includes budget concerns.
IA: Pain indicators are stronger than real pain.
IA: Real pain is always spoken clearly."
pain,q11,61,"Why is active listening critical during the pain step?","CA: It builds trust and encourages the prospect to share real pain.
IA: It shortens the sales cycle.
IA: It replaces the need for questioning.
IA: It increases control over the prospect."
pain,q12,62,"What is the purpose of the “Let You and Him Fight” technique?","CA: To create contrast without directly attacking the competition.
IA: To openly criticise competitors.
IA: To force the prospect to choose sides.
IA: To introduce pricing pressure."
pain,q13,63,"What is the fundamental Sandler rule regarding pain?","CA: No pain, no sale.
IA: No budget, no sale.
IA: No urgency, no sale.
IA: No presentation, no sale."
budget,q1,1,"What is the primary focus of the Budget step in the Sandler selling system?","CA: Discussing money, budgets, where the money comes from, and who controls spending.
IA: Presenting features and benefits.
IA: Building rapport only.
IA: Demonstrating technical expertise."
budget,q2,2,"Why does the Sandler system recommend dealing with money issues early?","CA: To qualify prospects early and avoid wasting time later in the sales process.
IA: To shorten presentations.
IA: To eliminate objections entirely.
IA: To remove competition."
budget,q3,3,"What is the recommended response when a prospect says they have no budget?","CA: Respond empathetically and ask how they plan to move forward.
IA: End the meeting immediately.
IA: Push the prospect to find the money.
IA: Move straight to a proposal."
budget,q4,4,"Why is asking for budget 'in round numbers' effective?","CA: It feels non-threatening and encourages honest sharing.
IA: It avoids discussing money.
IA: It speeds up the closing process.
IA: It allows prices to be increased later."
budget,q5,5,"What is the purpose of the monkey’s fist strategy?","CA: To make large buying decisions easier by selling a smaller first step.
IA: To discount large deals heavily.
IA: To avoid large sales.
IA: To replace negotiation."
